{
  "entry": {
    "function": "fixture_main",
    "observe_state_slot": "gpr:r2"
  },
  "host_contract": {
    "sha256": "b3ed66de6cba949dc1690d873209cd6d4be49144b3a794542a852b0a151ea588",
    "version": "0.1.1"
  },
  "initial_state": [],
  "ir": {
    "sha256": "51dd1115886bc720830f755d0f75effb1fb71e1ca7289967a9320fb727646a3f",
    "source_input_sha256": "c9b60aa0df3f95d7d35bbae92c2a99ccc65646bfb3ee44e7c3fc546146ee6e88",
    "version": "1.0.0"
  },
  "limits": {
    "max_call_depth": 1024,
    "max_operations": 200000
  },
  "memory": {
    "segments": [],
    "size_bytes": 262144
  },
  "module_format_version": "1.0.0",
  "module_id": "openrecomp.mips32.synthetic.vertical-slice-v1",
  "provenance": {
    "producer": "openrecomp.mips32-v1-slice",
    "source_input_sha256": "c9b60aa0df3f95d7d35bbae92c2a99ccc65646bfb3ee44e7c3fc546146ee6e88"
  }
}
